{
  "$schema":"https://json-schema.org/draft/2020-12/schema",
  "$id":"https://ars-caeli.local/contracts/v0.2/behavioral-trial.schema.json",
  "type":"object","additionalProperties":false,
  "required":["schema_version","trial_id","probe_id","trial_index","presentations","response_key","scoring_rule_id","timing_policy"],
  "properties":{"schema_version":{"const":"0.2-draft"},"trial_id":{"type":"string"},"probe_id":{"type":"string"},"trial_index":{"type":"integer","minimum":0},"presentations":{"type":"array","minItems":2,"items":{"type":"object","additionalProperties":false,"required":["slot","stimulus_ref"],"properties":{"slot":{"type":"integer","minimum":0},"stimulus_ref":{"type":"string"}}}},"response_key":{"type":"object","additionalProperties":false,"required":["correct_choice_id"],"properties":{"correct_choice_id":{"type":"string"}}},"scoring_rule_id":{"type":"string"},"timing_policy":{"type":"object","additionalProperties":false,"required":["clock_source"],"properties":{"clock_source":{"type":"string"}}}}
}
