{"schema_version":"0.2-draft","trial_id":"pg01-trial-0001","probe_id":"pg01-geometric-regularity","trial_index":0,"presentations":[{"slot":0,"stimulus_ref":"pg.regularity.hex.0001"},{"slot":1,"stimulus_ref":"pg.regularity.hex.0002"}],"response_key":{"correct_choice_id":"left"},"scoring_rule_id":"choice_key_v0.1","timing_policy":{"clock_source":"performance.now"}}